<?xml version="1.0" encoding="UTF-8" ?>
<PaymentSystem xmlns="http://tsiamruk.it-academy.by/xml/paymentSystem"
               xmlns:xs="http://www.w3.org/2001/XMLSchema-instance"
               xs:schemaLocation="http://tsiamruk.it-academy.by/xml/paymentSystem paymentSystem.xsd">
    <Clients>
        <Client>
            <Email>
                ivan@ivanov.com
            </Email>
            <Login>
                Ivan001
            </Login>
            <Password>
                qwerty123
            </Password>
        </Client>
        <Client>
            <Email>
                bogdan@bogdanov.com
            </Email>
            <Login>
                BogdigLoL
            </Login>
            <Password>
                qwerty0123
            </Password>
        </Client>
    </Clients>
    <Accounts>
        <Account>
            <TotalAmount>
                1000
            </TotalAmount>
            <Status>
                Unlocked
            </Status>
        </Account>
        <Account>
            <TotalAmount>
                2
            </TotalAmount>
            <Status>
                Blocked
            </Status>
        </Account>
    </Accounts>
    <Admin>
        <Login>
            root
        </Login>
        <Password>
            root
        </Password>
        <UnlockAccount>
            <getId>
                00000
            </getId>
        </UnlockAccount>
    </Admin>
</PaymentSystem>